{
  "id": "NS-PURE-SWIRL-ADAPTIVE-DIAMETER-SELECTION",
  "problem": "navier-stokes",
  "statement": "Soit F lisse compact dans l'anneau méridien R/2<r<3R/2, U=(R/r)F e_theta, W=curl U, K=||U||_(L^(3,infinity))>0, H=||W||_(L^(3/2,infinity))>0 et q=K/H. Il existe un niveau presque optimal lambda avec lambda R>=K^2/(432H), un niveau régulier t dans (lambda/4,3lambda/8), un signe et une composante active C_beta de {sigma F>t} tels que la troncature U_beta=(R/r)(sigma F-t)_+1_(C_beta)e_theta vérifie diam_z(C_beta)/R<=2239488 q^(-3), ||U_beta||_(L^(3,infinity))>=(C_I/20736)K^2/H et ||U_beta||_(L^(3,infinity))/||curl U_beta||_(L^(3/2,infinity))>=(C_I/20736)q^2. Composé avec la sélection cellulaire disjointe, le rapport local est au moins (C_I^3/2176782336)q_global^4 et le diamètre normalisé au plus 2239488(324/C_I)^3q_global^(-6).",
  "status": "COMPUTATION_ONLY",
  "hypotheses": [
    "R>0 et F appartient à C_c^infinity((0,infinity) x R)",
    "supp F est inclus dans {R/2<r<3R/2}",
    "U=(R/r)F e_theta est un champ divergence-free compact sur R3 et W=curl U=(R/r)(-partial_z F e_r+partial_r F e_z)",
    "K et H utilisent la convention sup_s s |{|f|>s}|^(1/p) et sont strictement positifs",
    "C_I est la constante fixée par Per_3(E)>=C_I |E|^(2/3)",
    "une composante active rencontre le core signé {sigma F>lambda/2}",
    "la troncature est comprise au sens W_c^(1,infinity), avec gradient presque partout et sans mesure de bord",
    "le corollaire familial suppose les supports complets, donc les curls, disjoints avant la première sélection"
  ],
  "dependencies": [
    "NS-PURE-SWIRL-COMMON-LEVEL-CELL-SELECTION",
    "NS-PURE-SWIRL-LIPSCHITZ-DIRECTION-GATE",
    "NS-PURE-SWIRL-PERSISTENT-BRIDGE-DIAMETER"
  ],
  "evidence": [
    {
      "kind": "primary_source",
      "reference": "NS-SRC-0132 pour coaire; NS-SRC-0148 pour isopérimétrie R3; NS-SRC-0156 pour composantes et périmètres; NS-SRC-0163 pour 2 diam(E^1)<=P_2(E). Les constantes et la composition axisymétrique sont internes."
    },
    {
      "kind": "derivation",
      "reference": "docs/reports/navier-stokes/cycle-0038-adaptive-diameter-selection.md"
    },
    {
      "kind": "computation",
      "reference": "experiments/navier-stokes/adaptive-diameter-selection/adaptive_diameter_audit.py; 12243 assertions rationnelles exactes sur 2016 registres et 24 profondeurs, résidu nul",
      "sha256": "0f607fc228c6c552b323b0b342bfa83356afde2dff61831fe606c0e20a1e235e"
    },
    {
      "kind": "derivation",
      "reference": "docs/reports/navier-stokes/reviews/cycle-0038-analysis.md; audit initial de l'itération puis validation indépendante des constantes 432, 20736 et 2239488",
      "sha256": "7535d86eb663ab6ab4768861012311db040c78f19ddd86a3b75ef61ee0c2c53d"
    },
    {
      "kind": "counterexample",
      "reference": "docs/reports/navier-stokes/reviews/cycle-0038-countermodel.md; arbre dyadique exact, 9513 assertions, réfutation du bookkeeping seul et localisation du défaut coaire",
      "sha256": "7727fc752cdc01b50762b1720dbd83af081d6b522192b22094b14bb1e63a1496"
    },
    {
      "kind": "derivation",
      "reference": "docs/reports/navier-stokes/reviews/cycle-0038-literature.md; stabilité primaire des merge trees, distinction barcode/maximin et non-transfert des analogues 2D",
      "sha256": "fd94f74fa0ddbfc5379ea5de0fefffbaf522987c72f6d2690de788e6bccfb7fa"
    }
  ],
  "provenance": {
    "created_at": "2026-08-15",
    "producer_type": "ai",
    "producer": "Millennium Forge et OpenAI Codex",
    "model": "GPT-5",
    "prompt_or_run": "navier-stokes-cycle-0038-adaptive-diameter-selection"
  },
  "review": {
    "status": "adversarial_pass",
    "reviewer": "Trois passes IA séparées: audit analytique, contre-modèle exact et audit bibliographique; aucune revue humaine externe",
    "notes": "Ont été audités: facteurs annulaires, coaire, volume de révolution, finitude des composantes actives, même niveau pour diamètre et endpoint, trace nulle, domination H_beta<=H, scaling, arbre de profondeur arbitraire et stabilité topologique. Restent ouverts les curls superposés avec annulation, la projection de Leray, la pression, la dynamique et le raccord Clay."
  }
}
