{
  "id": "NS-OSCILLATORY-TRACE-DEFECT-FAMILY",
  "problem": "navier-stokes",
  "statement": "Pour chaque entier N positif, la famille périodique explicite construite dans QUADRATIC-PRESSURE-DEFECT-1 est une solution globale lisse de Navier–Stokes 3D non forcé; aux temps t_N=log(2)/(N^2+1), ses vitesses convergent faiblement vers zéro, leurs tenseurs quadratiques ont une limite faible non nulle et leurs pressions moyennes nulles convergent fortement vers une limite non nulle explicite.",
  "status": "COMPUTATION_ONLY",
  "hypotheses": [
    "domaine T^3=(R/2piZ)^3 sans frontière, conditions périodiques",
    "viscosité nu=1 et force extérieure nulle",
    "u_N^0=(-sin(x_1)sin(Nx_2),-N^-1 cos(x_1)cos(Nx_2),0)",
    "u_N(t)=exp(-(N^2+1)t)u_N^0 et pression de moyenne nulle recalculée par l'équation de Poisson",
    "t_N=log(2)/(N^2+1)",
    "convergence faible testée dans les distributions périodiques, donc dans L^2 faible pour la vitesse uniformément bornée"
  ],
  "dependencies": [],
  "evidence": [
    {
      "kind": "derivation",
      "reference": "experiments/navier-stokes/README.md, section QUADRATIC-PRESSURE-DEFECT-1"
    },
    {
      "kind": "computation",
      "reference": "experiments/navier-stokes/quadratic-pressure-defect/quadratic_pressure_defect.py",
      "sha256": "9c85df21a8e847f17568c5e54e2bbd57fccc45775b0994383af2d93da89756f7"
    }
  ],
  "provenance": {
    "created_at": "2026-08-14",
    "producer_type": "ai",
    "producer": "OpenAI Codex",
    "model": "GPT-5",
    "prompt_or_run": "navier-stokes-state-of-art/cycle-0004"
  },
  "review": {
    "status": "adversarial_pass",
    "reviewer": "Sous-agent Codex distinct, même famille de modèle; non indépendant au sens externe",
    "notes": "Divergence, convection, signe de Poisson, évolution visqueuse, énergie et limites recalculés. La pression converge même fortement dans tout L^q fini; aucun défaut intérieur espace-temps."
  }
}
