{
  "id": "NS-TYPE-I-WEAK-L3-PARABOLIC-CORE-CAPTURE",
  "problem": "navier-stokes",
  "statement": "Soit u une solution de Leray–Hopf de Navier–Stokes incompressible 3D non forcé sur R3, lisse avant son premier temps singulier T_* et singulière en (x_*,T_*). Si sup_(0<t<T_*) ||u(t)||_(L^(3,infinity))<=M<infinity pointwise, alors il existe gamma_w>0 universel et une fonction S_w^*>0 issus de l'extension Lorentz du théorème de lissage local tels que, pour tout 0<t<T_* et R_M(t)=2 sqrt((T_*-t)/S_w^*(C_M M)), ||u(t)||_(L^(3,infinity)(B(x_*,R_M(t))))>gamma_w et la fraction de la quasi-norme globale est supérieure à gamma_w/M, où C_M=sqrt(3)(4pi/3)^(1/6).",
  "status": "COMPUTATION_ONLY",
  "hypotheses": [
    "viscosité normalisée à un, domaine R3, aucune force et aucune frontière",
    "u est une solution de Leray–Hopf d'énergie finie, lisse sur (0,T_*) et T_* est son premier temps singulier",
    "le point (x_*,T_*) est singulier au sens de l'absence de voisinage parabolique où u est essentiellement bornée",
    "la borne globale Type I sup_t ||u(t)||_(L^(3,infinity))<=M est uniforme jusqu'à T_*",
    "la quasi-norme est sup_(s>0) s |{|f|>s}|^(1/3)",
    "gamma_w et S_w^* sont les constantes, éventuellement rétrécies par rapport au théorème L3 imprimé, de l'extension Lorentz publiée et de sa contraposition de concentration"
  ],
  "dependencies": [],
  "evidence": [
    {
      "kind": "primary_source",
      "reference": "NS-SRC-0146; Barker–Prange, ARMA 236 (2020), théorème 2 et appendice B pour la concentration L^(3,infinity) au rayon parabolique sous Type I"
    },
    {
      "kind": "derivation",
      "reference": "docs/reports/navier-stokes/cycle-0041-type-i-core-capture.md; passage explicite faible-L3 vers Morrey local L2 et fraction gamma_w/M"
    },
    {
      "kind": "computation",
      "reference": "experiments/navier-stokes/type-i-core-capture/type_i_capture_audit.py; 1346 assertions rationnelles pour la constante trois, sa saturation et le facteur relatif",
      "sha256": "8337e0aced23e4bd815f1d759e226a41a8867c4de826932dcf261aa3f051de76"
    },
    {
      "kind": "counterexample",
      "reference": "docs/reports/navier-stokes/reviews/cycle-0041-countermodel.md; l'absolue minoration locale ne donne pas de fraction sans borne globale",
      "sha256": "d06d20ce4119a758ded3c17b047276122f87ab997aaf365c931f73e9a2987dd6"
    },
    {
      "kind": "derivation",
      "reference": "docs/reports/navier-stokes/reviews/cycle-0041-analysis.md; audit indépendant des quantificateurs, constantes Lorentz et représentants temporels",
      "sha256": "9253c83764126296492b37be11b51c8e4d163bdfff94921a02fb80f324e641a6"
    },
    {
      "kind": "primary_source",
      "reference": "docs/reports/navier-stokes/reviews/cycle-0041-literature.md; réaudit du théorème 2, de l'appendice B et veille différentielle Type I/II 2025–2026",
      "sha256": "db4346ac65a8009c03258892022bc516cce2a5b58a070fc2edbcb0e283f79537"
    }
  ],
  "provenance": {
    "created_at": "2026-08-15",
    "producer_type": "ai",
    "producer": "Millennium Forge et OpenAI Codex",
    "model": "GPT-5",
    "prompt_or_run": "navier-stokes-cycle-0041-type-i-core-capture"
  },
  "review": {
    "status": "adversarial_pass",
    "reviewer": "Composition interne d'un théorème publié, un audit analytique séparé et un certificat exact; aucune revue humaine externe",
    "notes": "Le théorème de concentration est publié, mais la formule relative et la constante C_M sont une composition interne. Le claim est conditionnel à un blow-up Type I et ne couvre pas Type II. Il ne construit pas de singularité et ne prouve pas qu'un blow-up Type I existe."
  }
}
