{
  "id": "NS-L3-CONTROLS-PRESSURE-TAIL",
  "problem": "navier-stokes",
  "statement": "Pour tout champ U dans L^3(R^3), la queue pondérée satisfait intégrale_{|y|>A}|U(y)|^2|y|^-4 dy <= (4pi/9)^(1/3) A^-3 ||U||_3^2; si sup_n||U_n||_3<=M, le supremum des queues est donc au plus (4pi/9)^(1/3)A^-3M^2 et décroît uniformément vers zéro.",
  "status": "COMPUTATION_ONLY",
  "hypotheses": [
    "U appartient à L^3(R^3;R^3)",
    "A>0",
    "la conclusion de pression utilise en plus A>2a sur la boule B_a",
    "aucune conclusion sur la pression proche, la dynamique ou une borne L^3 a priori"
  ],
  "dependencies": [
    "NS-ENDPOINT-L3-REGULARITY",
    "NS-PRESSURE-WEIGHTED-TAIL-CRITERION"
  ],
  "evidence": [
    {
      "kind": "derivation",
      "reference": "experiments/navier-stokes/README.md, corollaire L3 de PRESSURE-MULTISCALE-1"
    },
    {
      "kind": "derivation",
      "reference": "literature/navier-stokes/compactness-rigidity-extraction.md, section 5",
      "sha256": "b1638e8f3d91a15c3b0eeacbb6fc2bb04f7b8e673a816aa5b19a1a4847aaddf5"
    }
  ],
  "provenance": {
    "created_at": "2026-08-14",
    "producer_type": "ai",
    "producer": "OpenAI Codex",
    "model": "GPT-5",
    "prompt_or_run": "navier-stokes-state-of-art/cycle-0003"
  },
  "review": {
    "status": "adversarial_pass",
    "reviewer": "Sous-agent Codex distinct, même famille de modèle; non indépendant au sens externe",
    "notes": "Exposants 3/2 et 3, intégrale radiale, constante et limite uniforme recalculés; l'extraction primaire confirme que ce calcul est interne et que l'implication de pression reste conditionnelle à A>2a."
  }
}
