{
  "id": "NS-KNSS-MAXIMUM-ZOOM-NONZERO-TRACE",
  "problem": "navier-stokes",
  "statement": "Pour les zooms par temps records de la proposition 6.1 de KNSS appliqués à une solution mild de Navier–Stokes 3D dont le temps maximal fini serait singulier, les estimations de lissage uniformes jusqu'au temps-record redimensionné s=0 rendent commutables les limites k->infinity et s->0- dans D'_local; leur valeur commune est non nulle, et il existe une constante c_*>0 telle que l'intégrale de |u(t_k)|^3 sur une boule de rayon comparable à M_k^-1 soit au moins c_*. Ici s=0 correspond à t_k, tandis que le temps physique T correspond à l'extrémité future mobile B_k=M_k^2(T-t_k); aucune trace à T n'est obtenue.",
  "status": "COMPUTATION_ONLY",
  "hypotheses": [
    "équation incompressible standard sur R^3, viscosité 1, force nulle et absence de frontière",
    "solution classique/mild sur un intervalle maximal [0,T) avec T fini et norme L-infinity spatiale non bornée à l'approche de T",
    "temps records, centres x_k, amplitudes M_k et facteurs gamma_k choisis exactement comme dans la proposition 6.1 de KNSS",
    "normalisation v_k(y,s)=M_k^-1 u(x_k+M_k^-1 y,t_k+M_k^-2 s), avec |v_k|<=gamma_k sur le passé et |v_k(0,0)|=1",
    "les horloges sont distinguées explicitement: A_k=-M_k^2 t_k tend vers moins l'infini, s=0 représente t_k, et T représente B_k=M_k^2(T-t_k)>0",
    "la convergence est prise après la sous-suite KNSS et dans des topologies locales; aucune trace physique contre des tests fixes n'est confondue avec les tests mobiles du zoom",
    "la constante de concentration dépend seulement des constantes de lissage KNSS après normalisation; elle n'est pas rendue numérique dans ce claim",
    "le statut COMPUTATION_ONLY enregistre une dérivation IA auditée et un contrôle algébrique, pas un PAPER_PROOF ni une revendication de nouveauté publiée"
  ],
  "dependencies": [
    "NS-HYBRID-ANCIENT-GATE-NOT-INHERITED",
    "NS-BOUNDED-ANCIENT-MILD-ZERO-TRACE-RIGIDITY"
  ],
  "evidence": [
    {
      "kind": "primary_source",
      "reference": "Koch–Nadirashvili–Seregin–Šverák, Acta Mathematica 203 (2009), Lemma 6.1, Proposition 6.1 and Proposition 4.1, DOI 10.1007/s11511-009-0039-6"
    },
    {
      "kind": "primary_source",
      "reference": "Peter Constantin, Pressure, Intermittency, Singularity, Journal of Mathematical Fluid Mechanics 25 (2023), article 36, condition (23) and Theorem 2, DOI 10.1007/s00021-023-00779-7; used to bound novelty of the uniform L3 non-concentration corollary"
    },
    {
      "kind": "derivation",
      "reference": "literature/navier-stokes/compactness-rigidity-extraction.md, section 11, and docs/reports/navier-stokes/cycle-0009-maximum-zoom-trace.md"
    },
    {
      "kind": "computation",
      "reference": "experiments/navier-stokes/maximum-zoom-trace/commutator_obligations.json",
      "sha256": "2fa2148a5ebb7b8fcce370655faca1df4b2c4a56990f99704481e54bf060d51e"
    },
    {
      "kind": "computation",
      "reference": "experiments/navier-stokes/maximum-zoom-trace/commutator_audit.py",
      "sha256": "00334a12f7b51cb4f5a397e28f014230d2126cfd1cbbe8b2ffec90aa9c729451"
    }
  ],
  "provenance": {
    "created_at": "2026-08-14",
    "producer_type": "ai",
    "producer": "OpenAI Codex",
    "model": "GPT-5",
    "prompt_or_run": "navier-stokes-state-of-art/cycle-0009"
  },
  "review": {
    "status": "adversarial_pass",
    "reviewer": "Trois sous-agents Codex ont audité séparément analyse PDE, contre-profils et littérature; même famille de modèle, donc revue non externe",
    "notes": "La passe distingue temps-record t_k et temps physique T, tests physiques fixes et tests mobiles concentrés, point normalisé et distribution, R^3 et tore, solution mild et solution classique à pression affine. La couche terminale e^(k^2 s)e_1 donne une non-commutation avec résidu PDE nul mais échoue précisément à la mildness et au module temporel uniforme. Dans la vraie classe KNSS, les estimations paraboliques rétablissent la commutation au temps-record et conservent une valeur non nulle; elles ne contrôlent pas l'extrémité mobile B_k. La borne L3 locale est une reformulation de concentration, non une estimation issue de l'énergie ni un nouveau critère de régularité au regard de Constantin 2023."
  }
}
