{
  "id": "NS-ONEIL-LOG-TRANSFER",
  "problem": "navier-stokes",
  "statement": "Soient des champs sur R³ tels que, uniformément dans le paramètre temporel, mu_omega(lambda)<=V[(Omega/lambda)/log(lambda/Omega)]^(3/2) pour lambda>=eOmega, M=sup_s s^(2/3)omega*(s)<infinity, et u=B[omega]+h avec une inégalité d'O'Neil de constante C_K et ||h||_infinity<=H. Alors, pour 0<v<=Vexp(-6), u*(v)<=Qv^(-1/3)/log(eV/v), où C_0=4Omega V^(2/3) et Q=C_K(23C_0+9M)+HV^(1/3).",
  "status": "COMPUTATION_ONLY",
  "hypotheses": [
    "R³ sans frontière; omega=|curl u| et div u=0 dans une classe où la décomposition de Biot-Savart est définie",
    "V>0, Omega>0, C_K, M et H sont uniformes dans le temps",
    "la queue logarithmique de vorticité vaut pour tout lambda>=eOmega avec superniveaux stricts",
    "le contrôle global faible L^(3/2) M rend finie la queue macroscopique d'O'Neil",
    "la composante harmonique h est nulle ou uniformément bornée",
    "le résultat est fonctionnel et suppose la distribution (40); il ne démontre pas sa production par Navier–Stokes"
  ],
  "dependencies": [],
  "evidence": [
    {
      "kind": "primary_source",
      "reference": "NS-SRC-0059, arXiv:2607.08866v2, équations (40)-(47), passage conditionnel audité"
    },
    {
      "kind": "primary_source",
      "reference": "NS-SRC-0067, O'Neil 1963, inégalité primaire de convolution et de réarrangement"
    },
    {
      "kind": "derivation",
      "reference": "docs/reports/navier-stokes/cycle-0016-oneil-transfer.md"
    },
    {
      "kind": "computation",
      "reference": "experiments/navier-stokes/oneil-transfer/oneil_transfer_audit.py, fractions exactes et supersolution analytique",
      "sha256": "cab6da2b536cfd5a72fd669887fe7dc444a283eba081bbfb9b02b9889897c06f"
    },
    {
      "kind": "derivation",
      "reference": "docs/reports/navier-stokes/reviews/cycle-0016-analysis.md; cycle-0016-literature.md; cycle-0016-countermodel.md"
    }
  ],
  "provenance": {
    "created_at": "2026-08-14",
    "producer_type": "ai",
    "producer": "Millennium Forge et OpenAI Codex",
    "model": "GPT-5",
    "prompt_or_run": "navier-stokes-cycle-0016-oneil-transfer"
  },
  "review": {
    "status": "adversarial_pass",
    "reviewer": "Trois passes Codex séparées, même famille de modèle; non indépendantes au sens externe",
    "notes": "Les trois passes confirment les exposants et la nécessité des seuils, du contrôle global et de la jauge harmonique. Elles ne valident pas la dérivation dynamique de l'équation (40)."
  }
}
