{
  "id": "NS-LRT-DOUBLE-CONE-REGULARITY",
  "problem": "navier-stokes",
  "statement": "Selon Lei–Ren–Tian arXiv:2501.08976v1, une solution faible adaptée locale de Navier–Stokes 3D est régulière intérieurement si toute vorticité dépassant un seuil fixe a sa direction confinée dans un double cône fixe d'ouverture uniforme.",
  "status": "SOURCE_VERIFIED",
  "hypotheses": [
    "Navier–Stokes incompressible 3D non forcé, viscosité un, dans Q(1)=B(1)×(-1,0)",
    "solution faible adaptée locale avec pression dans L^(3/2)_loc",
    "il existe e dans S² et delta,M>0 fixes tels qu'à chaque point régulier, |omega|<=M ou |xi cross e|<=1-delta",
    "la conclusion est la régularité dans la fermeture de Q(1/2)",
    "source prépublication v1 non publiée au 2026-08-14"
  ],
  "dependencies": [],
  "evidence": [
    {
      "kind": "primary_source",
      "reference": "Zhen Lei, Xiao Ren, Gang Tian, A Geometric Characterization of Potential Navier-Stokes Singularities, arXiv:2501.08976v1, théorème 1.1"
    },
    {
      "kind": "derivation",
      "reference": "docs/reports/navier-stokes/reviews/cycle-0022-literature.md: transfert explicite d'une rectification uniforme vers le double cône"
    }
  ],
  "provenance": {
    "created_at": "2026-08-14",
    "producer_type": "ai",
    "producer": "Millennium Forge et OpenAI Codex",
    "model": "GPT-5",
    "prompt_or_run": "navier-stokes-cycle-0022-differential-watch"
  },
  "review": {
    "status": "adversarial_pass",
    "reviewer": "Passe bibliographique Codex séparée, même famille de modèle; non indépendante au sens externe",
    "notes": "Le statut SOURCE_VERIFIED atteste l'extraction de l'énoncé primaire, pas une reproduction de la preuve. Le raccord au cas log-rectifié exige uniformité espace-temps, confinement de tous les grands niveaux et un axe fixe."
  }
}
