{
  "id": "NS-KOCH-TATARU-SMALL-BMO",
  "problem": "navier-stokes",
  "statement": "Koch et Tataru établissent une bonne position globale mild sur R^3 pour des données initiales divergence-free suffisamment petites dans BMO^{-1}; la petitesse empêche d'étendre ce résultat à toute donnée Clay.",
  "status": "SOURCE_VERIFIED",
  "hypotheses": [
    "Navier-Stokes incompressible non forcé sur R^3",
    "donnée divergence-free suffisamment petite dans BMO^{-1}",
    "solution mild dans l'espace de résolution de l'article"
  ],
  "dependencies": [],
  "evidence": [
    {
      "kind": "primary_source",
      "reference": "H. Koch, D. Tataru, Well-posedness for the Navier-Stokes equations, Advances in Mathematics 157 (2001): https://doi.org/10.1006/aima.2000.1937"
    }
  ],
  "provenance": {
    "created_at": "2026-08-14",
    "producer_type": "ai",
    "producer": "OpenAI Codex",
    "model": "GPT-5",
    "prompt_or_run": "navier-stokes-state-of-art/checkpoint-initial"
  },
  "review": {
    "status": "adversarial_pass",
    "reviewer": "OpenAI Codex, seconde lecture non indépendante",
    "notes": "La passe adverse conserve explicitement la petitesse et la notion mild."
  }
}
