{
  "id": "NS-CKN-PARTIAL-REGULARITY",
  "problem": "navier-stokes",
  "statement": "Pour les solutions faibles adaptées tridimensionnelles considérées par Caffarelli, Kohn et Nirenberg, l'ensemble singulier intérieur a mesure de Hausdorff parabolique unidimensionnelle nulle; le théorème ne prouve pas que cet ensemble est vide.",
  "status": "SOURCE_VERIFIED",
  "hypotheses": [
    "Navier-Stokes incompressible en dimension trois",
    "solution faible adaptée avec inégalité d'énergie locale",
    "hypothèses locales de pression de l'article"
  ],
  "dependencies": [
    "NS-LERAY-WEAK-EXISTENCE"
  ],
  "evidence": [
    {
      "kind": "primary_source",
      "reference": "L. Caffarelli, R. Kohn, L. Nirenberg, Partial regularity of suitable weak solutions of the Navier-Stokes equations, CPAM 35 (1982): https://doi.org/10.1002/cpa.3160350604"
    }
  ],
  "provenance": {
    "created_at": "2026-08-14",
    "producer_type": "ai",
    "producer": "OpenAI Codex",
    "model": "GPT-5",
    "prompt_or_run": "navier-stokes-state-of-art/checkpoint-initial"
  },
  "review": {
    "status": "adversarial_pass",
    "reviewer": "OpenAI Codex, seconde lecture non indépendante",
    "notes": "La passe adverse rejette explicitement l'inférence mesure nulle implique ensemble vide."
  }
}
